,chapter,text
0,IN WHICH POOH AND PIGLET GO HUNTING AND NEARLY CATCH A WOOZLE,"The Piglet lived in a very grand house in the middle of a beech-tree, and the beech-tree was in the middle of the forest, and the Piglet lived in the middle of the house. Next to his house was a piece of broken board which had: ""TRESPASSERS W"" on it. When Christopher Robin asked the Piglet what it meant, he said it was his grandfather's name, and had been in the family for a long time, Christopher Robin said you _couldn't_ be called Trespassers W, and Piglet said yes, you could, because his grandfather was, and it was short for Trespassers Will, which was short for Trespassers William. And his grandfather had had two names in case he lost one--Trespassers after an uncle, and William after Trespassers.  ""I've got two names,"" said Christopher Robin carelessly.  ""Well, there you are, that proves it,"" said Piglet.  One fine winter's day when Piglet was brushing away the snow in front of his house, he happened to look up, and there was Winnie-the-Pooh. Pooh was walking round and round in a circle, thinking of something else, and when Piglet called to him, he just went on walking.  ""Hallo!"" said Piglet, ""what are _you_ doing?""  ""Hunting,"" said Pooh.  ""Hunting what?""  ""Tracking something,"" said Winnie-the-Pooh very mysteriously.  ""Tracking what?"" said Piglet, coming closer.  ""That's just what I ask myself. I ask myself, What?""  ""What do you think you'll answer?""  ""I shall have to wait until I catch up with it,"" said Winnie-the-Pooh. ""Now, look there."" He pointed to the ground in front of him. ""What do you see there?""  ""Tracks,"" said Piglet. ""Paw-marks."" He gave a little squeak of excitement. ""Oh, Pooh! Do you think it's a--a--a Woozle?""  ""It may be,"" said Pooh. ""Sometimes it is, and sometimes it isn't. You never can tell with paw-marks.""  With these few words he went on tracking, and Piglet, after watching him for a minute or two, ran after him. Winnie-the-Pooh had come to a sudden stop, and was bending over the tracks in a puzzled sort of way.  ""What's the matter?"" asked Piglet.  ""It's a very funny thing,"" said Bear, ""but there seem to be _two_ animals now. This--whatever-it-was--has been joined by another--whatever-it-is--and the two of them are now proceeding in company. Would you mind coming with me, Piglet, in case they turn out to be Hostile Animals?""  Piglet scratched his ear in a nice sort of way, and said that he had nothing to do until Friday, and would be delighted to come, in case it really _was_ a Woozle.  ""You mean, in case it really is two Woozles,"" said Winnie-the-Pooh, and Piglet said that anyhow he had nothing to do until Friday. So off they went together.  There was a small spinney of larch trees just here, and it seemed as if the two Woozles, if that is what they were, had been going round this spinney; so round this spinney went Pooh and Piglet after them; Piglet passing the time by telling Pooh what his Grandfather Trespassers W had done to Remove Stiffness after Tracking, and how his Grandfather Trespassers W had suffered in his later years from Shortness of Breath, and other matters of interest, and Pooh wondering what a Grandfather was like, and if perhaps this was Two Grandfathers they were after now, and, if so, whether he would be allowed to take one home and keep it, and what Christopher Robin would say. And still the tracks went on in front of them....  Suddenly Winnie-the-Pooh stopped, and pointed excitedly in front of him. ""_Look!_""  ""_What?_"" said Piglet, with a jump. And then, to show that he hadn't been frightened, he jumped up and down once or twice more in an exercising sort of way.  ""The tracks!"" said Pooh. ""_A third animal has joined the other two!_""  ""Pooh!"" cried Piglet. ""Do you think it is another Woozle?""  ""No,"" said Pooh, ""because it makes different marks. It is either Two Woozles and one, as it might be, Wizzle, or Two, as it might be, Wizzles and one, if so it is, Woozle. Let us continue to follow them.""  So they went on, feeling just a little anxious now, in case the three animals in front of them were of Hostile Intent. And Piglet wished very much that his Grandfather T. W. were there, instead of elsewhere, and Pooh thought how nice it would be if they met Christopher Robin suddenly but quite accidentally, and only because he liked Christopher Robin so much. And then, all of a sudden, Winnie-the-Pooh stopped again, and licked the tip of his nose in a cooling manner, for he was feeling more hot and anxious than ever in his life before. _There were four animals in front of them!_  ""Do you see, Piglet? Look at their tracks! Three, as it were, Woozles, and one, as it was, Wizzle. _Another Woozle has joined them!_""  And so it seemed to be. There were the tracks; crossing over each other here, getting muddled up with each other there; but, quite plainly every now and then, the tracks of four sets of paws.  ""I _think_,"" said Piglet, when he had licked the tip of his nose too, and found that it brought very little comfort, ""I _think_ that I have just remembered something. I have just remembered something that I forgot to do yesterday and shan't be able to do to-morrow. So I suppose I really ought to go back and do it now.""  ""We'll do it this afternoon, and I'll come with you,"" said Pooh.  ""It isn't the sort of thing you can do in the afternoon,"" said Piglet quickly. ""It's a very particular morning thing, that has to be done in the morning, and, if possible, between the hours of----What would you say the time was?""  ""About twelve,"" said Winnie-the-Pooh, looking at the sun.  ""Between, as I was saying, the hours of twelve and twelve five. So, really, dear old Pooh, if you'll excuse me----_What's that?_""  Pooh looked up at the sky, and then, as he heard the whistle again, he looked up into the branches of a big oak-tree, and then he saw a friend of his.  ""It's Christopher Robin,"" he said.  ""Ah, then you'll be all right,"" said Piglet. ""You'll be quite safe with _him_. Good-bye,"" and he trotted off home as quickly as he could, very glad to be Out of All Danger again.  Christopher Robin came slowly down his tree.  ""Silly old Bear,"" he said, ""what _were_ you doing? First you went round the spinney twice by yourself, and then Piglet ran after you and you went round again together, and then you were just going round a fourth time----""  ""Wait a moment,"" said Winnie-the-Pooh, holding up his paw.  He sat down and thought, in the most thoughtful way he could think. Then he fitted his paw into one of the Tracks ... and then he scratched his nose twice, and stood up.  ""Yes,"" said Winnie-the-Pooh.  ""I see now,"" said Winnie-the-Pooh.  ""I have been Foolish and Deluded,"" said he, ""and I am a Bear of No Brain at All.""  ""You're the Best Bear in All the World,"" said Christopher Robin soothingly.  ""Am I?"" said Pooh hopefully. And then he brightened up suddenly.  ""Anyhow,"" he said, ""it is nearly Luncheon Time.""  So he went home for it."
1,IN WHICH EEYORE LOSES A TAIL AND POOH FINDS ONE,"The Old Grey Donkey, Eeyore, stood by himself in a thistly corner of the forest, his front feet well apart, his head on one side, and thought about things. Sometimes he thought sadly to himself, ""Why?"" and sometimes he thought, ""Wherefore?"" and sometimes he thought, ""Inasmuch as which?""--and sometimes he didn't quite know what he _was_ thinking about. So when Winnie-the-Pooh came stumping along, Eeyore was very glad to be able to stop thinking for a little, in order to say ""How do you do?"" in a gloomy manner to him.  ""And how are you?"" said Winnie-the-Pooh.  Eeyore shook his head from side to side.  ""Not very how,"" he said. ""I don't seem to have felt at all how for a long time.""  ""Dear, dear,"" said Pooh, ""I'm sorry about that. Let's have a look at you.""  So Eeyore stood there, gazing sadly at the ground, and Winnie-the-Pooh walked all round him once.  ""Why, what's happened to your tail?"" he said in surprise.  ""What _has_ happened to it?"" said Eeyore.  ""It isn't there!""  ""Are you sure?""  ""Well, either a tail _is_ there or it isn't there. You can't make a mistake about it. And yours _isn't_ there!""  ""Then what is?""  ""Nothing.""  ""Let's have a look,"" said Eeyore, and he turned slowly round to the place where his tail had been a little while ago, and then, finding that he couldn't catch it up, he turned round the other way, until he came back to where he was at first, and then he put his head down and looked between his front legs, and at last he said, with a long, sad sigh, ""I believe you're right.""  ""Of course I'm right,"" said Pooh.  ""That Accounts for a Good Deal,"" said Eeyore gloomily. ""It Explains Everything. No Wonder.""  ""You must have left it somewhere,"" said Winnie-the-Pooh.  ""Somebody must have taken it,"" said Eeyore. ""How Like Them,"" he added, after a long silence.  Pooh felt that he ought to say something helpful about it, but didn't quite know what. So he decided to do something helpful instead.  ""Eeyore,"" he said solemnly, ""I, Winnie-the-Pooh, will find your tail for you.""  ""Thank you, Pooh,"" answered Eeyore. ""You're a real friend,"" said he. ""Not like Some,"" he said.  So Winnie-the-Pooh went off to find Eeyore's tail.  It was a fine spring morning in the forest as he started out. Little soft clouds played happily in a blue sky, skipping from time to time in front of the sun as if they had come to put it out, and then sliding away suddenly so that the next might have his turn. Through them and between them the sun shone bravely; and a copse which had worn its firs all the year round seemed old and dowdy now beside the new green lace which the beeches had put on so prettily. Through copse and spinney marched Bear; down open slopes of gorse and heather, over rocky beds of streams, up steep banks of sandstone into the heather again; and so at last, tired and hungry, to the Hundred Acre Wood. For it was in the Hundred Acre Wood that Owl lived.  ""And if anyone knows anything about anything,"" said Bear to himself, ""it's Owl who knows something about something,"" he said, ""or my name's not Winnie-the-Pooh,"" he said. ""Which it is,"" he added. ""So there you are.""  Owl lived at The Chestnuts, an old-world residence of great charm, which was grander than anybody else's, or seemed so to Bear, because it had both a knocker _and_ a bell-pull. Underneath the knocker there was a notice which said:                     PLES RING IF AN RNSER IS REQIRD.  Underneath the bell-pull there was a notice which said:                    PLEZ CNOKE IF AN RNSR IS NOT REQID.  These notices had been written by Christopher Robin, who was the only one in the forest who could spell; for Owl, wise though he was in many ways, able to read and write and spell his own name WOL, yet somehow went all to pieces over delicate words like MEASLES and BUTTEREDTOAST.  Winnie-the-Pooh read the two notices very carefully, first from left to right, and afterwards, in case he had missed some of it, from right to left. Then, to make quite sure, he knocked and pulled the knocker, and he pulled and knocked the bell-rope, and he called out in a very loud voice, ""Owl! I require an answer! It's Bear speaking."" And the door opened, and Owl looked out.  ""Hallo, Pooh,"" he said. ""How's things?""  ""Terrible and Sad,"" said Pooh, ""because Eeyore, who is a friend of mine, has lost his tail. And he's Moping about it. So could you very kindly tell me how to find it for him?""  ""Well,"" said Owl, ""the customary procedure in such cases is as follows.""  ""What does Crustimoney Proseedcake mean?"" said Pooh. ""For I am a Bear of Very Little Brain, and long words Bother me.""  ""It means the Thing to Do.""  ""As long as it means that, I don't mind,"" said Pooh humbly.  ""The thing to do is as follows. First, Issue a Reward. Then----""  ""Just a moment,"" said Pooh, holding up his paw. ""_What_ do we do to this--what you were saying? You sneezed just as you were going to tell me.""  ""I _didn't_ sneeze.""  ""Yes, you did, Owl.""  ""Excuse me, Pooh, I didn't. You can't sneeze without knowing it.""  ""Well, you can't know it without something having been sneezed.""  ""What I _said_ was, 'First _Issue_ a Reward'.""  ""You're doing it again,"" said Pooh sadly.  ""A Reward!"" said Owl very loudly. ""We write a notice to say that we will give a large something to anybody who finds Eeyore's tail.""  ""I see, I see,"" said Pooh, nodding his head. ""Talking about large somethings,"" he went on dreamily, ""I generally have a small something about now--about this time in the morning,"" and he looked wistfully at the cupboard in the corner of Owl's parlour; ""just a mouthful of condensed milk or whatnot, with perhaps a lick of honey----""  ""Well, then,"" said Owl, ""we write out this notice, and we put it up all over the forest.""  ""A lick of honey,"" murmured Bear to himself, ""or--or not, as the case may be."" And he gave a deep sigh, and tried very hard to listen to what Owl was saying.  But Owl went on and on, using longer and longer words, until at last he came back to where he started, and he explained that the person to write out this notice was Christopher Robin.  ""It was he who wrote the ones on my front door for me. Did you see them, Pooh?""  For some time now Pooh had been saying ""Yes"" and ""No"" in turn, with his eyes shut, to all that Owl was saying, and having said, ""Yes, yes,"" last time, he said ""No, not at all,"" now, without really knowing what Owl was talking about.  ""Didn't you see them?"" said Owl, a little surprised. ""Come and look at them now.""  So they went outside. And Pooh looked at the knocker and the notice below it, and he looked at the bell-rope and the notice below it, and the more he looked at the bell-rope, the more he felt that he had seen something like it, somewhere else, sometime before.  ""Handsome bell-rope, isn't it?"" said Owl.  Pooh nodded.  ""It reminds me of something,"" he said, ""but I can't think what. Where did you get it?""  ""I just came across it in the Forest. It was hanging over a bush, and I thought at first somebody lived there, so I rang it, and nothing happened, and then I rang it again very loudly, and it came off in my hand, and as nobody seemed to want it, I took it home, and----""  ""Owl,"" said Pooh solemnly, ""you made a mistake. Somebody did want it.""  ""Who?""  ""Eeyore. My dear friend Eeyore. He was--he was fond of it.""  ""Fond of it?""  ""Attached to it,"" said Winnie-the-Pooh sadly.                   *        *        *        *        *  So with these words he unhooked it, and carried it back to Eeyore; and when Christopher Robin had nailed it on in its right place again, Eeyore frisked about the forest, waving his tail so happily that Winnie-the-Pooh came over all funny, and had to hurry home for a little snack of something to sustain him. And, wiping his mouth half an hour afterwards, he sang to himself proudly:      _Who found the Tail?_       ""I,"" said Pooh,     ""At a quarter to two       (Only it was quarter to eleven really),     _I_ found the Tail!"""
